{
  "model_version": "0.1.0",
  "model_family": "inc15d6-govman-2025-coverage",
  "source_package_id": "GOVMAN-2025-12-31",
  "source_publication_date": "2025-12-31",
  "source_original_sha256": "c1e5b58cce0a018b4995f900584605d07e473079a37d5a665a3a8ebb5d643138",
  "source_original_git_blob_sha1": "195c46a67c87ae85f1dedd423250900f119a041a",
  "source_original_repository_path": "evidence/govman-2025/originals/sha256/c1e5b58cce0a018b4995f900584605d07e473079a37d5a665a3a8ebb5d643138.xml",
  "whole_edition_publisher_entries": 231,
  "existing_provisional_canonical_links": 50,
  "existing_unlinked_source_entries": 181,
  "current_first_level_institution_denominator": null,
  "whole_federal_legal_institution_denominator": null,
  "independent_legal_review_complete": false,
  "independent_worm_custody_verified": false,
  "canonical_component_identities_minted": 0,
  "legally_certified_subordinate_components": 0,
  "observed_command_delegations": 0,
  "new_atlas_relationships": 0,
  "departments_count": 2,
  "selected_publisher_entries": 15,
  "accounted_publisher_entries": 15,
  "unaccounted_selected_entries": 0,
  "commerce_observations": 10,
  "education_publisher_heading_observations": 1,
  "education_publisher_affiliate_observations": 4,
  "publisher_grouping_or_affiliate_observations_not_canonical_agencies": 5,
  "previous_unlinked_181_entries_reclassified_as_canonical": 0,
  "previous_50_canonical_name_links_modified": 0,
  "previous_28_INC15D5_curation_records_modified": 0,
  "current_legal_organizational_denominator_is_known": false,
  "earlier_2026_commerce_web_source_original_retained": false,
  "items": [
    {
      "id": "INC15D6-COV-113",
      "publisher_department_root_key": "GOVMAN-2025-12-31:113",
      "department_canonical_anchor_id": "ORG-FED-EXE-DEP-COMMERCE",
      "root_publisher_name": "Department of Commerce",
      "publisher_full_subtree_count": 11,
      "existing_canonical_root_links": 1,
      "publisher_selected_unlinked_records": 10,
      "publisher_entries_accounted": 10,
      "commerce_first_level_source_only_candidates": 10,
      "education_directory_grouping_records": 0,
      "education_affiliate_legal_identity_unresolved_records": 0,
      "prior_expansion_research_seed_overlaps": 2,
      "prior_exact_dated_commerce_web_unit_refs": 8,
      "prior_verified_GovInfo_granule_refs": 2,
      "unreviewed_source_name_variants": 1,
      "canonical_component_matches": 0,
      "independent_legal_component_certifications": 0,
      "new_atlas_relationships": 0,
      "independently_verified_direct_command_edges": 0,
      "publisher_subtree_is_verified_federal_institution_inventory": false
    },
    {
      "id": "INC15D6-COV-115",
      "publisher_department_root_key": "GOVMAN-2025-12-31:115",
      "department_canonical_anchor_id": "ORG-FED-EXE-DEP-EDUCATION",
      "root_publisher_name": "Department of Education",
      "publisher_full_subtree_count": 6,
      "existing_canonical_root_links": 1,
      "publisher_selected_unlinked_records": 5,
      "publisher_entries_accounted": 5,
      "commerce_first_level_source_only_candidates": 0,
      "education_directory_grouping_records": 1,
      "education_affiliate_legal_identity_unresolved_records": 4,
      "prior_expansion_research_seed_overlaps": 0,
      "prior_exact_dated_commerce_web_unit_refs": 0,
      "prior_verified_GovInfo_granule_refs": 0,
      "unreviewed_source_name_variants": 0,
      "canonical_component_matches": 0,
      "independent_legal_component_certifications": 0,
      "new_atlas_relationships": 0,
      "independently_verified_direct_command_edges": 0,
      "publisher_subtree_is_verified_federal_institution_inventory": false
    }
  ]
}
